{
  "incident_id": "sb-000123",
  "schema_version": "1.0.0",
  "event_source": {
    "type": "edr",
    "name": "synthetic-generator-v1",
    "license": "CC-BY-4.0",
    "provenance_url": "https://github.com/Hamzakhan7473/sentinelbench/blob/main/data/README.md"
  },
  "raw_events": [
    {
      "event_id": "evt-1",
      "timestamp": "2026-07-10T14:02:11Z",
      "raw": {
        "process": "powershell.exe",
        "parent_process": "winword.exe",
        "command_line": "powershell -enc SQBFAFgA...",
        "host": "WKSTN-042",
        "user": "j.doe"
      }
    },
    {
      "event_id": "evt-2",
      "timestamp": "2026-07-10T14:02:14Z",
      "raw": {
        "process": "powershell.exe",
        "network_connection": "185.220.101.7:443",
        "host": "WKSTN-042"
      }
    }
  ],
  "label": "malicious",
  "severity": "high",
  "attack_techniques": [
    { "technique_id": "T1566.001", "technique_name": "Spearphishing Attachment", "tactic": "initial-access" },
    { "technique_id": "T1059.001", "technique_name": "PowerShell", "tactic": "execution" }
  ],
  "supporting_event_ids": ["evt-1", "evt-2"],
  "expected_investigation_steps": [
    {
      "step": "Identify that powershell.exe was spawned by winword.exe, an unusual parent-child relationship.",
      "rationale": "Office applications spawning script interpreters is a well-known initial-access/execution pattern.",
      "supporting_event_ids": ["evt-1"]
    },
    {
      "step": "Decode the base64-encoded PowerShell command line to inspect its behavior.",
      "rationale": "Encoded commands are commonly used to evade simple string-based detection.",
      "supporting_event_ids": ["evt-1"]
    },
    {
      "step": "Check the destination IP of the outbound connection against threat intel for known C2 infrastructure.",
      "rationale": "Confirms whether the PowerShell process is beaconing to an attacker-controlled server.",
      "supporting_event_ids": ["evt-2"]
    }
  ],
  "expected_containment_actions": [
    { "action": "Isolate host WKSTN-042 from the network.", "rationale": "Prevents further C2 communication or lateral movement from the compromised host.", "priority": "immediate" },
    { "action": "Reset credentials for user j.doe.", "rationale": "Mitigates risk of credential theft from the compromised session.", "priority": "high" }
  ],
  "metadata": {
    "author": "sentinelbench-maintainers",
    "created": "2026-07-18",
    "dataset_split": "train",
    "tags": ["phishing", "powershell", "c2"]
  }
}
